question,response
hi im a prospective student can you tell me about the admission requirements,sure for undergraduate programs we require a high school diploma and sat or act scores for graduate programs we require a bachelors degree and gre scores is there anything else youd like to know
how much is the tuition for the business program,the tuition for the business program is x per year you may also be eligible for scholarships or financial aid
thats expensive are there any payment plans available,yes we offer payment plans that allow you to spread out the cost over several months would you like more information on this
yes please,great i can send you a link to our payment plan options whats your email address
myemailexamplecom,okay ill send that over shortly do you have any other questions
